CPUID 00000000: 00000016-756E6547-6C65746E-49656E69 [GenuineIntel]
CPUID 00000001: 000806EA-05100800-7FFAFBBF-BFEBFBFF
CPUID 00000002: 76036301-00F0B5FF-00000000-00C30000
CPUID 00000003: 00000000-00000000-00000000-00000000
CPUID 00000004: 1C004121-01C0003F-0000003F-00000000 [SL 00]
CPUID 00000004: 1C004122-01C0003F-0000003F-00000000 [SL 01]
CPUID 00000004: 1C004143-00C0003F-000003FF-00000000 [SL 02]
CPUID 00000004: 1C03C163-03C0003F-00001FFF-00000006 [SL 03]
CPUID 00000005: 00000040-00000040-00000003-11142120
CPUID 00000006: 000027F7-00000002-00000009-00000000
CPUID 00000007: 00000000-029C67AF-00000000-9C000000 [SL 00]
CPUID 00000008: 00000000-00000000-00000000-00000000
CPUID 00000009: 00000000-00000000-00000000-00000000
CPUID 0000000A: 07300404-00000000-00000000-00000603
CPUID 0000000B: 00000001-00000002-00000100-00000005 [SL 00]
CPUID 0000000B: 00000004-00000008-00000201-00000005 [SL 01]
CPUID 0000000C: 00000000-00000000-00000000-00000000
CPUID 0000000D: 0000001F-00000440-00000440-00000000
CPUID 0000000E: 00000000-00000000-00000000-00000000
CPUID 0000000F: 00000000-00000000-00000000-00000000
CPUID 00000010: 00000000-00000000-00000000-00000000
CPUID 00000011: 00000000-00000000-00000000-00000000
CPUID 00000012: 00000000-00000000-00000000-00000000 [SL 00]
CPUID 00000012: 00000000-00000000-00000000-00000000 [SL 01]
CPUID 00000013: 00000000-00000000-00000000-00000000
CPUID 00000014: 00000001-0000000F-00000007-00000000 [SL 00]
CPUID 00000014: 02490002-003F3FFF-00000000-00000000 [SL 01]
CPUID 00000015: 00000002-000000A6-00000000-00000000
CPUID 00000016: 000007D0-00000FA0-00000064-00000000
CPUID 80000000: 80000008-00000000-00000000-00000000
CPUID 80000001: 00000000-00000000-00000121-2C100800
CPUID 80000002: 65746E49-2952286C-726F4320-4D542865 [Intel(R) Core(TM]
CPUID 80000003: 37692029-3535382D-43205530-40205550 [) i7-8550U CPU @]
CPUID 80000004: 382E3120-7A484730-00000000-00000000 [ 1.80GHz]
CPUID 80000005: 00000000-00000000-00000000-00000000
CPUID 80000006: 00000000-00000000-01006040-00000000
CPUID 80000007: 00000000-00000000-00000000-00000100
CPUID 80000008: 00003027-00000000-00000000-00000000
